{
  "schema_version": "1.0",
  "engine": "crasme.gate 1.1.0",
  "product_id": "DEMO-001",
  "product_version": "1.2.0",
  "build_sha": "3f2c9e1d3f2c9e1d3f2c9e1d3f2c9e1d3f2c9e1d",
  "artifact_digest": "sha256:abababababababababababababababababababababababababababababababab",
  "decision": "REVIEW_REQUIRED",
  "reasons": [
    "LEGAL_MAPPING_REVIEW_PENDING"
  ],
  "details": [
    {
      "code": "LEGAL_MAPPING_REVIEW_PENDING",
      "severity": "REVIEW",
      "description": "in-force mandatory obligation(s) without verified legal mapping",
      "detail": "38 row(s)",
      "refs": [
        "CA-01",
        "DOC-01",
        "DOC-EU-01",
        "ID-01",
        "OP-01",
        "P1-01",
        "P1-a",
        "P1-b",
        "P1-c",
        "P1-d",
        "P1-e",
        "P1-f",
        "P1-g",
        "P1-h",
        "P1-i",
        "P1-j",
        "P1-k",
        "P1-l",
        "P1-m",
        "P2-1",
        "P2-2",
        "P2-3",
        "P2-5",
        "P2-6",
        "P2-7",
        "P2-8",
        "RA-01",
        "RA-02",
        "RA-03",
        "SC-01",
        "SCOPE-01",
        "SER-01",
        "SPOC-01",
        "SUP-01",
        "SUP-02",
        "TD-01",
        "TD-02",
        "UI-01"
      ]
    }
  ],
  "stats": {
    "scans_recorded": 3,
    "scans_ok": 3,
    "findings_unique": 1,
    "kev_hits": 0,
    "evidence_records": 40,
    "evidence_valid": 40,
    "mandatory_obligations_in_force": 38,
    "mandatory_obligations_not_yet_in_force": 0
  },
  "eligible_for_human_conformity_review": false,
  "legal_conformity": "NOT_DETERMINED_BY_TOOL",
  "as_of": "2027-12-20T12:00:00+00:00",
  "timestamp_utc": "2027-12-20T12:00:00+00:00",
  "input_digests": {
    "approvals.json": "9468fd00776478d96b366933cb5ea43ecb7f3c44da6c97791cdb7a62d2bea698",
    "evidence-CA-01.md": "5174dc4e45250713f3ef514386f01bde8c9205c35c35ccaffc4a082c2ea4ee03",
    "evidence-DOC-01.md": "c926979e060e9b08b32590d85423c34daa5cb8644ee1a5fe57a10ce620244b95",
    "evidence-DOC-EU-01.md": "28407f03b283c0672485f4763bc0d1d72c832cb8c095324ddfaa9f5c906daaef",
    "evidence-ID-01.md": "f31ecfb7d55f904b3dc491cf458c0349b11e88347f7b170f855c33ce0e23e540",
    "evidence-OP-01.md": "a72c0d53f5606ba0dfb4ab8edb7251da59bdc9b06ea92c7916010a47a9cbe6d9",
    "evidence-P1-01.md": "2772f0a56849464747dfd8e31e9f5f12897b113c5133d7014d2ce90fab877632",
    "evidence-P1-a.md": "904ebb63a6f9f44ae15274afb1de85625d070830e9dcb8fd6e9a22dc06fa47d6",
    "evidence-P1-b.md": "28f550458f08b6c341b85ad9fdfce292bc999cedcb36733e9c78faa733473d90",
    "evidence-P1-c.md": "0f3fa36c30e23bc1d1d4dd7b6d2f731b543c53ea6e580234c8b07b7ec9bc79b9",
    "evidence-P1-d.md": "930b47fbf63713c452d216c825daac4a3ed47abf62488fa3c96c0b0ee44d0010",
    "evidence-P1-e.md": "5c5a681b631b3b74d30fd00e5ca6fc664126386f037b9f1829f9c9e01b5fbe64",
    "evidence-P1-f.md": "ba0af237c98db982bcd2c35ae3c2d1e7f649a143df741e52e4ea6eede7bc5321",
    "evidence-P1-g.md": "f69dfe8f56f250eecfa38df02cbec08255830bd77ae0e052b221251e12305e21",
    "evidence-P1-h.md": "6e79810632d23321b38c029ef0ab046b03167566fed2c717e32c1faf1479222a",
    "evidence-P1-i.md": "df1d7f0d1ac68eda993abd73fa87379ee6f91cbcf5f2e4792e68f1ae641e0375",
    "evidence-P1-j.md": "b904bcdd1925009f465c6658402cca56bdca2c30d54dd35c4c0bdc8ed277b660",
    "evidence-P1-k.md": "d22db3a620b5d3a69d901529b3283ef1a8128a79c02751aa8421a127467c225b",
    "evidence-P1-l.md": "d610c1f2fc8880b49c14f4d982bf913cdaf6e2df1eeab98951c6cf134d51967e",
    "evidence-P1-m.md": "7bdcea34af3264455fab40da23a923e6f0b2db438e6ce1a65b5453515d3faaa7",
    "evidence-P2-1.md": "b642959b6dfa9ce9b40b98ad379858651a68a6cfb44657ae6a86128e005f196c",
    "evidence-P2-2.md": "ea461f36bf6af4d2cd204c03a94a43f53493b33999222d0a7cfe3852b5482e5f",
    "evidence-P2-3.md": "e571b2fe30e63a4d54776de1aa6a1ef1c2b0496b07d9dbd795d2cc778ef251d7",
    "evidence-P2-5.md": "d468f63d16a3712f6fe566d353ca15f3af9eaa0cd27ceef79ba18b30a3ed609d",
    "evidence-P2-6.md": "1d4144a3347fa25b5dda431e28d64e7c928f91b32cee85f83262afedad2eb7a7",
    "evidence-P2-7.md": "f17495ed99e70ce463798710445601553626a568ff0e0884beefe22f056f1e14",
    "evidence-P2-8.md": "5d202b435eca6dafd195a9fe2024ed7f328d72967a5c3a493a16794ab12d7172",
    "evidence-RA-01.md": "baf5386842742af1ee2797470fef0b162752ae72b43f7becb646ce0044813798",
    "evidence-RA-02.md": "bd1e6d34799e841801dcbbd84d080629d2a751f20e4b315852205d9daecb493f",
    "evidence-RA-03.md": "e2895aab9a1d28f99cd994ddd8dc6ac24dc5462ec2f7c73fc3dddbf0e4afeb1e",
    "evidence-SC-01.md": "9c643b43529055a1d2673b1f28d60a7968aac6e19ab3df17ea108a6aaffa89f1",
    "evidence-SCOPE-01.md": "9e2212f2aa635ff2ecbf00f35cd5dd45c544500a2b91a766655d41dcc8d0d437",
    "evidence-SER-01.md": "6de640c219702960794ef636a37d584c39f86ddec4b98da48af2cfc11a5e41a5",
    "evidence-SPOC-01.md": "7e296fa8e714dee9adc0a01c53528ede8ddf3d55285e01de9ee53ca84e923c69",
    "evidence-SUP-01.md": "8ec8f8f6aec093c961a8269207fed5b6c9f859ee61f009f46c650b973e9e921b",
    "evidence-SUP-02.md": "41d9a210ac0c47c445a23daf44dde36608d67e43dd4d111c04ae02f47fb97378",
    "evidence-TD-01.md": "d8e95469e185d8b2989138f41fe543cb562b3ec2c7f623b33136b13865a476f6",
    "evidence-TD-02.md": "0419ace66f6f83ddd063cb78efcfeec6f54077776a35e2457eb8b207a11d11f1",
    "evidence-UI-01.md": "88c85b78bd6e41e0be258bd9938b5627b5937a9cc56b4201f50970dc1cb44304",
    "evidence-manifest.json": "c7e5d8486bcb030f6c42769aa73d46ab909414b42bb44bc274df4970089ba1f9",
    "kev.json": "132a66dd2057eaba1fc543b371a29ca95e8b3baf2f17d1610b18e5bcb9dbe0a9",
    "product.json": "fbdcf02954754014373a18409afd609eac2a68449efec72dd822aaf61bf77887",
    "sbom.cdx.json": "d01efbba89248619c94f7088d1f4ea0a50e3088a2aacb51cd2044413bb506f3c",
    "scan-status.json": "75d56a36e2ef6ba7abcde8240bc40fe068319eab00f5046945a32dd0bc37e0e7",
    "trace-units.json": "7940aadf505a4af7c07cc617ea3ab63780f5fbd194a7cb5818697f5e9e2eccb4",
    "vex.json": "8a356221b389609e1946e5babd27484653d1bb522c7368b9a48406f06ff8232c",
    "vulns.json": "5ee48dd4f31665067f39891c6cea8c9587a775180f358481a94bdd13af8c96c3"
  },
  "bundle_digest": "014763853fb69cd99e13b9ccf3ce324d528047fb20b88ad014daa5fbe6f36500",
  "policy_digest": "4116539a66ec200dd53fe5d5564defc9c33de42d9265c8b67c24d0461f30d8bb",
  "disclaimer": "Automated evidence check only. Not legal advice and not a conformity assessment."
}